{
  "schema_version": "ai-for-research.module-3-completion.v1",
  "module_id": "module-3",
  "route": "faculty",
  "checks": {
    "evidence_ready": true,
    "problem_statement_reviewed": true,
    "candidate_gap_reviewed": true,
    "reverse_search_completed": true,
    "learner_decision_recorded": true,
    "local_validator_passed": true
  },
  "metrics": {
    "reference_count": 24,
    "reference_verified_count": 21,
    "reference_not_found_count": 1,
    "reference_unresolved_count": 2,
    "pdf_downloaded_count": 17,
    "pdf_missing_count": 7,
    "markdown_reference_count": 17,
    "citation_count": 31,
    "citation_without_reference_count": 2,
    "citation_supported_count": 21,
    "citation_partial_count": 4,
    "citation_not_supported_count": 1,
    "citation_not_checkable_count": 5,
    "quartile_available_count": 18,
    "quartile_not_applicable_count": 3,
    "quartile_unresolved_count": 3,
    "h_index_available_count": 17,
    "h_index_not_applicable_count": 3,
    "h_index_unresolved_count": 4,
    "integrity_retracted_count": 1,
    "integrity_expression_of_concern_count": 0,
    "integrity_withdrawn_count": 0,
    "integrity_corrected_count": 2,
    "integrity_no_notice_count": 19,
    "integrity_unresolved_count": 2,
    "blind_spot_candidate_count": 6,
    "blind_spot_already_known_count": 2,
    "blind_spot_new_to_author_count": 2,
    "blind_spot_rejected_count": 1,
    "blind_spot_unresolved_count": 1,
    "classification_dimension_count": 7,
    "paper_classified_count": 24,
    "opportunity_candidate_count": 2,
    "opportunity_weakened_count": 1,
    "opportunity_rejected_count": 1,
    "opportunity_directly_aligned_count": 1,
    "opportunity_extends_scope_count": 1,
    "opportunity_tests_boundary_count": 1,
    "opportunity_adjacent_count": 1,
    "opportunity_unrelated_count": 0,
    "opportunity_author_endorsed_count": 2,
    "rq_candidate_count": 6,
    "rq_dimension_count": 6,
    "rq_ai_strong_count": 2,
    "rq_ai_develop_count": 3,
    "rq_ai_weak_count": 1,
    "rq_review_agree_count": 2,
    "rq_review_partly_agree_count": 2,
    "rq_review_disagree_count": 2,
    "rq_revised_rating_count": 4,
    "rq_new_to_author_count": 3,
    "rq_keep_count": 2,
    "rq_revise_count": 3,
    "rq_drop_count": 1
  },
  "artifacts": [
    {"path": "output/module-3/refs.bib", "sha256": "0000000000000000000000000000000000000000000000000000000000000000"},
    {"path": "output/module-3/reference-status.csv", "sha256": "0000000000000000000000000000000000000000000000000000000000000000"},
    {"path": "output/module-3/reference-download-report.csv", "sha256": "0000000000000000000000000000000000000000000000000000000000000000"},
    {"path": "output/module-3/citation-audit.csv", "sha256": "0000000000000000000000000000000000000000000000000000000000000000"},
    {"path": "output/module-3/author-prior.md", "sha256": "0000000000000000000000000000000000000000000000000000000000000000"},
    {"path": "output/module-3/reference-quality.csv", "sha256": "0000000000000000000000000000000000000000000000000000000000000000"},
    {"path": "output/module-3/blind-spot-ledger.csv", "sha256": "0000000000000000000000000000000000000000000000000000000000000000"},
    {"path": "output/module-3/reference-quality-assessment.md", "sha256": "0000000000000000000000000000000000000000000000000000000000000000"},
    {"path": "output/module-3/paper-classification.csv", "sha256": "0000000000000000000000000000000000000000000000000000000000000000"},
    {"path": "output/module-3/research-map.md", "sha256": "0000000000000000000000000000000000000000000000000000000000000000"},
    {"path": "output/module-3/seed-problem-statement.md", "sha256": "0000000000000000000000000000000000000000000000000000000000000000"},
    {"path": "output/module-3/opportunity-alignment.csv", "sha256": "0000000000000000000000000000000000000000000000000000000000000000"},
    {"path": "output/module-3/research-opportunity-brief.md", "sha256": "0000000000000000000000000000000000000000000000000000000000000000"},
    {"path": "output/module-3/research-question-candidates.csv", "sha256": "0000000000000000000000000000000000000000000000000000000000000000"},
    {"path": "output/module-3/rq-rating-review.csv", "sha256": "0000000000000000000000000000000000000000000000000000000000000000"}
  ]
}
